name,main_category,sub_category,image,link,ratings,no_of_ratings,discount_price,actual_price
"YoungUrban Women's Stretchable Gym, Running, Sports Shorts/Capri Combo Pack of 2",sports & fitness,Yoga,https://m.media-amazon.com/images/W/IMAGERENDERING_521856-T1/images/I/61XArlzS07L._AC_UL320_.jpg,https://www.amazon.in/YoungUrban-Womens-Stretchable-Running-Sports/dp/B0B12B4TYQ/ref=sr_1_3479?qid=1679217898&s=sports&sr=1-3479,4.1,13,₹625,₹899
Reebok Women's Sports Shorts,sports & fitness,Yoga,https://m.media-amazon.com/images/W/IMAGERENDERING_521856-T1/images/I/61XObFQxG-L._AC_UL320_.jpg,https://www.amazon.in/Reebok-Womens-Sports-Shorts-GL2624_Black_XL/dp/B08S45FXDS/ref=sr_1_3480?qid=1679217898&s=sports&sr=1-3480,4.7,9,"₹1,279","₹1,599"
"NEVER QUIT 3/4 Men & Women Unisex Capri Length Compression Tights Fitness & Other Outdoor Inner Wear Multi Sports Cycling,...",sports & fitness,Yoga,https://m.media-amazon.com/images/I/41YGFhzQy6L._AC_UL320_.jpg,https://www.amazon.in/NEVER-QUIT-Compression-Football-Badminton/dp/B0BM9WTKHX/ref=sr_1_3529?qid=1679217900&s=sports&sr=1-3529,4.0,1,₹374,₹799
Looky Wooky Bubu and Dudu Hoodie for Women | Unique Milk Mocha Hoodie for Wife | Best Birthday Gift for Girlfriend | Winte...,sports & fitness,Yoga,https://m.media-amazon.com/images/I/41cCMMHBBYL._AC_UL320_.jpg,https://www.amazon.in/Looky-Wooky-Birthday-Girlfriend-Sweatshirt/dp/B0BB89CK74/ref=sr_1_3530?qid=1679217900&s=sports&sr=1-3530,,,₹799,"₹1,200"
DECISIVE Fitness Jordan Piping Gym Running Workout Shorts for Men,sports & fitness,Yoga,https://m.media-amazon.com/images/I/71L-t2+ClJS._AC_UL320_.jpg,https://www.amazon.in/DECISIVE-Fitness-Jordan-Workout-Black-Grey-L/dp/B098L2KZ1H/ref=sr_1_3531?qid=1679217900&s=sports&sr=1-3531,4.0,5,,₹499
Inkholic Men's Round Collar Sports Jersey Multicolored INK500,sports & fitness,Yoga,https://m.media-amazon.com/images/I/71z1KcgqhoS._AC_UL320_.jpg,https://www.amazon.in/Inkholic-Sports-Jersey-Multicolored-X-Large/dp/B0969R9W6P/ref=sr_1_3532?qid=1679217900&s=sports&sr=1-3532,4.0,9,₹399,₹899
"SPOKOFIT (RED & BLACK ) Camo Yoga Mat With Strap, Non Slip Foldable Mat Camouflage Seamless Pattern Sweat Absorbent, for H...",sports & fitness,Yoga,https://m.media-amazon.com/images/I/516PqmcbFwL._AC_UL320_.jpg,https://www.amazon.in/SPOKOFIT-Foldable-Camouflage-Seamless-Absorbent/dp/B0BMX5NXZP/ref=sr_1_3533?qid=1679217900&s=sports&sr=1-3533,,,₹319,"₹1,199"
DEMAMD PRINT Kakashi Hoodie Black Men's Cotton Itachi Uchiha Dragon Ball z Women Jacket Anime Hooded Sweatshirt,sports & fitness,Yoga,https://m.media-amazon.com/images/I/51RDXekLq-L._AC_UL320_.jpg,https://www.amazon.in/DEMAMD-PRINT-Kakashi-Sweatshirt-x-Large/dp/B0BB35XHD2/ref=sr_1_3534?qid=1679217900&s=sports&sr=1-3534,4.3,9,₹799,"₹1,899"
ADRO Mens Break Your Limits Printed Hoodies,sports & fitness,Yoga,https://m.media-amazon.com/images/I/61C9Za0SvvL._AC_UL320_.jpg,https://www.amazon.in/ADRO-Cotton-Hooded-Sweatshirt-H22-1-BRE-RD-L_Red_L/dp/B0B9411X7T/ref=sr_1_3535?qid=1679217900&s=sports&sr=1-3535,3.4,10,₹849,"₹2,799"
DEMAMD PRINT Men Naruto Black Hoodie Women Jacket Ninetail Anime one Punch Man Kakashi Hooded Sweatshirt,sports & fitness,Yoga,https://m.media-amazon.com/images/I/61QxSoXS65L._AC_UL320_.jpg,https://www.amazon.in/DEMAMD-PRINT-Ninetail-Kakashi-Sweatshirt/dp/B0B5V5LB6L/ref=sr_1_3536?qid=1679217900&s=sports&sr=1-3536,4.2,16,₹799,"₹1,899"
Puma Women Shorts,sports & fitness,Yoga,https://m.media-amazon.com/images/I/71DtXEMpeLL._AC_UL320_.jpg,https://www.amazon.in/Puma-Womens-Bermuda-58682404_Light-Heather_M/dp/B089Z7YWFQ/ref=sr_1_3537?qid=1679217900&s=sports&sr=1-3537,4.6,48,"₹1,049","₹1,499"
RUBS Compression Shirts Shapewear Vest Body Shaper Abs Abdomen Slim Tank Top Undershirt for Men (White-Size-M),sports & fitness,Yoga,https://m.media-amazon.com/images/I/41CcPNQNucL._AC_UL320_.jpg,https://www.amazon.in/RUBS-Slimming-Tucker-Undershirt-Instantly/dp/B07Y8C7SCD/ref=sr_1_3538?qid=1679217900&s=sports&sr=1-3538,3.3,178,₹549,₹999
QUECY® Women's Sexy Booty Yoga Shorts Running Workout Fitness Active Mini Shorts,sports & fitness,Yoga,https://m.media-amazon.com/images/I/71npilJoTHL._AC_UL320_.jpg,https://www.amazon.in/QUECY%C2%AE-Womens-Running-Workout-Fitness/dp/B0BMPT9DHW/ref=sr_1_3539?qid=1679217900&s=sports&sr=1-3539,3.0,1,"₹1,109","₹2,197"
"Effingo: Yoga Mat for Exercise , Yoga , Workout. Comfortable Non Skid Mat for Fitness . ( Purple 4MM ).",sports & fitness,Yoga,https://m.media-amazon.com/images/I/51eE-zjgI-L._AC_UL320_.jpg,https://www.amazon.in/Effingo-Exercise-Workout-Comfortable-Fitness/dp/B0BCLPN6KH/ref=sr_1_3540?qid=1679217900&s=sports&sr=1-3540,,,₹198,₹799
"NAVYFIT Women's Comfort Fit Running, Gym, Yoga, Sport Workout Double Layer Shorts with Zip Pocket (Pack of 1) (WS01)",sports & fitness,Yoga,https://m.media-amazon.com/images/I/61soP4N3OTL._AC_UL320_.jpg,https://www.amazon.in/NAVYFIT-Comfort-Running-Workout-X-Large/dp/B0B3N1SN5N/ref=sr_1_3541?qid=1679217900&s=sports&sr=1-3541,,,₹699,"₹1,099"
Yonex 1594 Round Neck T-Shirt and Short Set for Junior,sports & fitness,Yoga,https://m.media-amazon.com/images/I/517A0M+q+VL._AC_UL320_.jpg,https://www.amazon.in/Yonex-Round-T-Shirt-Short-Junior/dp/B09ZBB8H1X/ref=sr_1_3542?qid=1679217900&s=sports&sr=1-3542,4.4,3,"₹1,979","₹2,180"
Reebok Men's Athletic Tights,sports & fitness,Yoga,https://m.media-amazon.com/images/I/51bPmHW1+EL._AC_UL320_.jpg,https://www.amazon.in/Reebok-Running-Speedwick-Tights-Hg6736-L/dp/B09MJG6VR4/ref=sr_1_3543?qid=1679217900&s=sports&sr=1-3543,4.0,1,"₹2,199","₹3,599"
Charged Active-001 Camo Jacquard Polyester Round Neck Sports T-Shirt Red Size Xl And Energy-004 Interlock Knit Hexagon Emb...,sports & fitness,Yoga,https://m.media-amazon.com/images/I/81h7gSDx8HL._AC_UL320_.jpg,https://www.amazon.in/Active-001-Jacquard-Polyester-Energy-004-Interlock/dp/B098P777N5/ref=sr_1_3544?qid=1679217900&s=sports&sr=1-3544,,,"₹1,176","₹1,248"
Adidas Men's Board Shorts (KO488_Black_XS),sports & fitness,Yoga,https://m.media-amazon.com/images/I/614E5Qguo7L._AC_UL320_.jpg,https://www.amazon.in/Adidas-Shorts-Regular-Polyester-KO488_Black_XS/dp/B094NLB2QC/ref=sr_1_3545?qid=1679217900&s=sports&sr=1-3545,,,,"₹1,058"
Madmax Compression Unisex Cycliing Short for Yoga Multi Sports Gym Fitness Cycling Athletics Indoor & Outdoor Sports wear,sports & fitness,Yoga,https://m.media-amazon.com/images/I/41Jz6zLXXlL._AC_UL320_.jpg,https://www.amazon.in/Madmax-Compression-Cycliing-Fitness-Athletics/dp/B08SM8RMP3/ref=sr_1_3546?qid=1679217900&s=sports&sr=1-3546,4.2,3,₹300,₹480
Reebok Men's Slim Fit T-Shirts,sports & fitness,Yoga,https://m.media-amazon.com/images/I/71UOUKtMcbS._AC_UL320_.jpg,https://www.amazon.in/Reebok-Regular-Mens-Shirts-FP9094_Prired/dp/B083GVTBBX/ref=sr_1_3547?qid=1679217900&s=sports&sr=1-3547,3.5,7,₹783,"₹1,799"
PROIRON NBR Yoga Mat 1830×660×10 mm - PURPLE Pilates Mat Edge Protection Non-Slip Yoga Mat Exercise Extra Thick Foam Mat F...,sports & fitness,Yoga,https://m.media-amazon.com/images/I/81RYDiqz8UL._AC_UL320_.jpg,https://www.amazon.in/PROIRON-NBR-Yoga-Mat-1830%C3%97660%C3%9710/dp/B07BKVGVKV/ref=sr_1_3548?qid=1679217900&s=sports&sr=1-3548,4.5,"2,230","₹2,475","₹3,725"
Indirage BTS Crop Hoodie for Women,sports & fitness,Yoga,https://m.media-amazon.com/images/I/711c9Vg3huL._AC_UL320_.jpg,https://www.amazon.in/Indirage-Crop-Hoodie-Women-Wild/dp/B09QYXSDHP/ref=sr_1_3549?qid=1679217900&s=sports&sr=1-3549,,,₹999,"₹1,999"
Beardo Black Hoodie for Men Range of Hoodies for Men | Cottonblend Sweatshirt for Men | Winter Jackets for Men | Winter we...,sports & fitness,Yoga,https://m.media-amazon.com/images/I/31DHPcfVZVL._AC_UL320_.jpg,https://www.amazon.in/Beardo-Cottonblend-Hooded-Hoodie-8906084795059_CharcoalGrey_M/dp/B09KLXG9L2/ref=sr_1_3550?qid=1679217900&s=sports&sr=1-3550,4.2,41,₹899,"₹1,499"
"SPOKOFIT YOGA MAT With BAG & STRAP Non slip yoga Mat , surface sticky with yoga mat Carry strap FOR GYM, WORKOUT. (WINE) (...",sports & fitness,Yoga,https://m.media-amazon.com/images/I/61XVZFSBkjL._AC_UL320_.jpg,https://www.amazon.in/SPOKOFIT-surface-sticky-WORKOUT-aasan/dp/B09JC6BYMN/ref=sr_1_3551?qid=1679217900&s=sports&sr=1-3551,3.5,55,₹218,"₹2,480"
ADRO Printed Hoodie for Men,sports & fitness,Yoga,https://m.media-amazon.com/images/I/61xcAzDvvdL._AC_UL320_.jpg,https://www.amazon.in/ADRO-Printed-Cotton-Hoodies-Olive/dp/B098B7GZH5/ref=sr_1_3552?qid=1679217900&s=sports&sr=1-3552,3.7,129,₹849,"₹2,799"
Shop The Arena: Los Angeles Lakers Sleeveless Hoodie (Black),sports & fitness,Yoga,https://m.media-amazon.com/images/W/IMAGERENDERING_521856-T1/images/I/51O72j3URBL._AC_UL320_.jpg,https://www.amazon.in/Shop-Arena-Angeles-Sleeveless-BlackXL/dp/B09MHBMBR1/ref=sr_1_3625?qid=1679217902&s=sports&sr=1-3625,4.1,9,₹899,"₹1,249"
"Bhuvan Handloom Furnishing Yoga Mat High Density, Anti-Slip Yoga mat for Gym Workout and Flooring Exercise Long Size. 4 mm...",sports & fitness,Yoga,https://m.media-amazon.com/images/W/IMAGERENDERING_521856-T1/images/I/51Qc43oddhL._AC_UL320_.jpg,https://www.amazon.in/Handloom-Furnishing-Anti-Slip-Flooring-Multicolor/dp/B08FXR9CNR/ref=sr_1_3626?qid=1679217902&s=sports&sr=1-3626,3.2,16,₹280,₹399
Men's Outdoor Quick Dry Lightweight Sports Shorts Zipper Pockets,sports & fitness,Yoga,https://m.media-amazon.com/images/W/IMAGERENDERING_521856-T1/images/I/510+dFvWx1L._AC_UL320_.jpg,https://www.amazon.in/Outdoor-Lightweight-Sports-Pockets-XX-Large/dp/B0BM57K2LD/ref=sr_1_3627?qid=1679217902&s=sports&sr=1-3627,,,₹699,₹999
BLUECON Women's Slim Fit Polyester Capri and Shorts,sports & fitness,Yoga,https://m.media-amazon.com/images/W/IMAGERENDERING_521856-T1/images/I/41Ti6P4mGiL._AC_UL320_.jpg,https://www.amazon.in/BLUECON-Womens-Polyester-Shorts-Tights/dp/B09PFVCLPH/ref=sr_1_3628?qid=1679217902&s=sports&sr=1-3628,4.4,4,₹399,₹999
QUADA Men & Women Compression Nylon Shorts Tights,sports & fitness,Yoga,https://m.media-amazon.com/images/W/IMAGERENDERING_521856-T1/images/I/51IcfeA+eXS._AC_UL320_.jpg,https://www.amazon.in/QUADA-Women-Compression-Shorts-Tights/dp/B09KLX2K3Y/ref=sr_1_3629?qid=1679217902&s=sports&sr=1-3629,,,₹265,₹799
YCC YOUNGCASH White Hand Black Stripe Full Sleeve Crop Hoodie for Women,sports & fitness,Yoga,https://m.media-amazon.com/images/W/IMAGERENDERING_521856-T1/images/I/314twSuzWCS._AC_UL320_.jpg,https://www.amazon.in/YCC-YOUNGCASH-Stripe-Sleeve-Hoodie/dp/B0981WMYR2/ref=sr_1_3630?qid=1679217902&s=sports&sr=1-3630,4.0,1,₹599,₹999
ATTIC CREATION Unisex BTS Printed Hoodie for Men & Women/Unisex Hoodie,sports & fitness,Yoga,https://m.media-amazon.com/images/W/IMAGERENDERING_521856-T1/images/I/51MDZFwaZuL._AC_UL320_.jpg,https://www.amazon.in/ATTIC-CREATION-Unisex-Printed-Hoodie/dp/B0BWRNQ328/ref=sr_1_3631?qid=1679217902&s=sports&sr=1-3631,,,₹599,"₹1,200"
TLISMI Super soft Women's Thick Nightgowns Hooded Drawstring Oversize Coral Fleece Warm Winter Elegant Style Blanket Sweat...,sports & fitness,Yoga,https://m.media-amazon.com/images/W/IMAGERENDERING_521856-T1/images/I/61llWmmebzL._AC_UL320_.jpg,https://www.amazon.in/TLISMI-Nightgowns-Drawstring-Sweatshirt-Oversized/dp/B0BS9K6696/ref=sr_1_3632?qid=1679217902&s=sports&sr=1-3632,,,"₹1,497","₹2,499"
VIMAL JONNEY Dryfit Lycra Solid Black Shorts for Women-Dryfit_D11_001-P,sports & fitness,Yoga,https://m.media-amazon.com/images/W/IMAGERENDERING_521856-T1/images/I/51tCjO0yJXL._AC_UL320_.jpg,https://www.amazon.in/VIMAL-JONNEY-Dryfit-Shorts-Women-Dryfit_D11_Black_001-M/dp/B09Y1PPZG6/ref=sr_1_3633?qid=1679217902&s=sports&sr=1-3633,3.0,2,₹299,₹899
A to Z Creation Crop Hoodie for Women Printed Winter Wear Hooded Sweatshirt,sports & fitness,Yoga,https://m.media-amazon.com/images/W/IMAGERENDERING_521856-T1/images/I/31VUKGEekPL._AC_UL320_.jpg,https://www.amazon.in/Creation-Womens-Sweatshirt-Printed-Regular/dp/B09QGH4VX5/ref=sr_1_3634?qid=1679217902&s=sports&sr=1-3634,3.5,35,₹490,₹799
Dagcros Women/Girl's Full Sleeve Hoody Cotton T-Shirt-WOMEN-BD-17,sports & fitness,Yoga,https://m.media-amazon.com/images/W/IMAGERENDERING_521856-T1/images/I/61QnoDJ43AL._AC_UL320_.jpg,https://www.amazon.in/Dagcros-Womens-T-Shirt-Multicolour-BD-17_34/dp/B09M4C1WY8/ref=sr_1_3635?qid=1679217902&s=sports&sr=1-3635,,,₹399,"₹1,499"
Kopykat Women's Fourway Lycra Active Shorties,sports & fitness,Yoga,https://m.media-amazon.com/images/W/IMAGERENDERING_521856-T1/images/I/61qXnUcISAS._AC_UL320_.jpg,https://www.amazon.in/Kopykat-Fourway-Spandex-Shorties-kop-32/dp/B096TR8R7S/ref=sr_1_3636?qid=1679217902&s=sports&sr=1-3636,4.2,22,₹279,₹599
Adidas Men's Shorts (GV0183_Blue_XS),sports & fitness,Yoga,https://m.media-amazon.com/images/W/IMAGERENDERING_521856-T1/images/I/81mJyQyQC3L._AC_UL320_.jpg,https://www.amazon.in/Adidas-Bermuda-Regular-Polyester-GV0183_CRENAV_Extra/dp/B08WK6MSYH/ref=sr_1_3637?qid=1679217902&s=sports&sr=1-3637,,,₹779,"₹2,499"
Glamcci Hoodie Sweatshirt for Women and Girls,sports & fitness,Yoga,https://m.media-amazon.com/images/W/IMAGERENDERING_521856-T1/images/I/6114Y+jas+L._AC_UL320_.jpg,https://www.amazon.in/Glamcci-Hoodie-Sweatshirt-Women-Medium/dp/B08SK3S44W/ref=sr_1_3638?qid=1679217902&s=sports&sr=1-3638,3.0,1,₹299,"₹1,199"
Puma Men's Cotton Shorts,sports & fitness,Yoga,https://m.media-amazon.com/images/W/IMAGERENDERING_521856-T1/images/I/81fZCP-R-iL._AC_UL320_.jpg,https://www.amazon.in/Puma-Mens-Cotton-Shorts-56238901_Black_L/dp/B009NE95V4/ref=sr_1_3639?qid=1679217902&s=sports&sr=1-3639,,,"₹1,605","₹2,699"
Larssst Official Women's Lavender Full Sleeve Cotton Printed Sweatshirt Hoodie,sports & fitness,Yoga,https://m.media-amazon.com/images/W/IMAGERENDERING_521856-T1/images/I/61KQxod-7LL._AC_UL320_.jpg,https://www.amazon.in/Larssst-Official-Lavender-Sweatshirt-Hoodie-LR335HWLBLESSED_XL/dp/B0BR5JWLXT/ref=sr_1_3640?qid=1679217902&s=sports&sr=1-3640,,,₹629,"₹1,599"
ZU Mens 100% Cotton Full Sleeve Solid Looper Hooded Neck Sweatshirt,sports & fitness,Yoga,https://m.media-amazon.com/images/W/IMAGERENDERING_521856-T1/images/I/61ImSqepffL._AC_UL320_.jpg,https://www.amazon.in/ZU-Cotton-Sleeve-Looper-Sweatshirt/dp/B0BKH6ZCRM/ref=sr_1_3641?qid=1679217902&s=sports&sr=1-3641,4.5,28,₹684,"₹1,299"
Puma Men Sweatshirt,sports & fitness,Yoga,https://m.media-amazon.com/images/W/IMAGERENDERING_521856-T1/images/I/71gfjNb7+zL._AC_UL320_.jpg,https://www.amazon.in/Puma-Polyester-Hooded-Sweatshirt-84989101_Black_2XL/dp/B0B9B2X5WM/ref=sr_1_3642?qid=1679217902&s=sports&sr=1-3642,5.0,1,"₹2,999","₹4,999"
AMARCOM Bunny Long Ear Hoodie for Women Full Sleeves Winter Wear Hooded Sweatshirt,sports & fitness,Yoga,https://m.media-amazon.com/images/W/IMAGERENDERING_521856-T1/images/I/31Mdjx50qsL._AC_UL320_.jpg,https://www.amazon.in/AMARCOM-Womens-Fleece-Sweatshirt-Hoodie_Pink_M/dp/B0B88C7F1L/ref=sr_1_3643?qid=1679217902&s=sports&sr=1-3643,3.3,7,₹699,"₹1,499"
shree chitransh creations BTS Bangtan Boys Colour Logo Kpop Fan Art Unisex Black Cotton Hooded Hoodie for Girls / Boys / Kids,sports & fitness,Yoga,https://m.media-amazon.com/images/W/IMAGERENDERING_521856-T1/images/I/31V6WlGC8uL._AC_UL320_.jpg,https://www.amazon.in/shree-chitransh-creations-Bangtan-Size-12-13/dp/B0B4WJ449D/ref=sr_1_3644?qid=1679217902&s=sports&sr=1-3644,,,₹999,"₹1,599"
Crazyink Boys Fleece Hooded Sweatshirt (Printedhoodie_Black_Bts_(8-9)Yr_Pink_15 Years-16 Years),sports & fitness,Yoga,https://m.media-amazon.com/images/W/IMAGERENDERING_521856-T1/images/I/613O+QIL+EL._AC_UL320_.jpg,https://www.amazon.in/CrazyInk-Fleece-PRINTEDHOODIE_Black_BTS_-YR_PINK_15-Years-16/dp/B09MZC8S56/ref=sr_1_3645?qid=1679217902&s=sports&sr=1-3645,4.0,38,₹589,₹999
JUST CARE Lower Tights Compression Wear Women/Men Pants/Lower/Bottom Skin fit Gym Yoga Sports Running,sports & fitness,Yoga,https://m.media-amazon.com/images/W/IMAGERENDERING_521856-T1/images/I/51CcxXl0usL._AC_UL320_.jpg,https://www.amazon.in/JUST-CARE-Tights-Compression-Running/dp/B091CYKW7T/ref=sr_1_3646?qid=1679217902&s=sports&sr=1-3646,,,,₹348
"HENCO Apple Cut Athletic Short/Half Pent for Multi Sports, Yoga, Running, Volleyball, Tennis, Cycling, Badminton, Gym & Fi...",sports & fitness,Yoga,https://m.media-amazon.com/images/W/IMAGERENDERING_521856-T1/images/I/71lIGnnv8eL._AC_UL320_.jpg,https://www.amazon.in/HENCO-Athletic-Running-Volleyball-Badminton/dp/B08R2RW9S4/ref=sr_1_3647?qid=1679217902&s=sports&sr=1-3647,3.3,21,₹399,₹599
Puma Boys Sweatshirt,sports & fitness,Yoga,https://m.media-amazon.com/images/W/IMAGERENDERING_521856-T1/images/I/51zxCqOl3wS._AC_UL320_.jpg,https://www.amazon.in/Puma-Hoodie-Regular-Sweatshirt-58455106_Peacoat_9-10/dp/B08MV9W7T5/ref=sr_1_3648?qid=1679217902&s=sports&sr=1-3648,3.8,5,"₹2,124.16","₹2,299"
Cloth Theory Girl's Printed Regular Fit Leggings (Pack of 2),sports & fitness,Yoga,https://m.media-amazon.com/images/I/91qIVG0BagS._AC_UL320_.jpg,https://www.amazon.in/Cloth-Theory-Printed-Leggings-CTLG015_Multi_11-12/dp/B08WCR21H5/ref=sr_1_3961?qid=1679217908&s=sports&sr=1-3961,3.8,225,₹629,₹999
The SV Style Unisex Maroon Hoodie with White Print: Shit JUST GOT Real/Printed Maroon Hoodie/Graphic Printed Hoodie/Hoodie...,sports & fitness,Yoga,https://m.media-amazon.com/images/I/410sv95bShL._AC_UL320_.jpg,https://www.amazon.in/SV-Style-Unisex-Maroon-Hoodie/dp/B089DFDXV1/ref=sr_1_3962?qid=1679217908&s=sports&sr=1-3962,4.3,5,₹850,"₹1,500"
"Pro Gym Women Compression T-Shirt, Top Full Sleeve Plain Athletic Fit Multi Sports Cycling, Cricket, Football, Badminton, ...",sports & fitness,Yoga,https://m.media-amazon.com/images/I/51z2GSZwBQL._AC_UL320_.jpg,https://www.amazon.in/Pro-Gym-Compression-Athletic-Badminton/dp/B07TJT78X7/ref=sr_1_3963?qid=1679217908&s=sports&sr=1-3963,,,₹474,₹999
"Nivia 2256M-4 Xenon-3 Polyester Sleeveless T-Shirt, M (Green)",sports & fitness,Yoga,https://m.media-amazon.com/images/I/81Zl2G-RNVL._AC_UL320_.jpg,https://www.amazon.in/Nivia-2256M-4-Xenon-3-Polyester-Sleeveless/dp/B07F713T7W/ref=sr_1_3964?qid=1679217908&s=sports&sr=1-3964,4.5,9,₹646,₹699
"Scott International Rich Cotton Winter Wear Hooded Sweatshirt for Men's & Boys- Cotton, Casual, Lightweight, Fashionable, ...",sports & fitness,Yoga,https://m.media-amazon.com/images/I/71BHREqN4eL._AC_UL320_.jpg,https://www.amazon.in/Scott-Premium-Cotton-Pullover-Sweatshirt/dp/B01C0AWD84/ref=sr_1_3965?qid=1679217908&s=sports&sr=1-3965,3.7,453,₹626,"₹2,999"
LITINSHA CREATION Women's Hoodie Sweatshirts Casual Thin Tunic Tops Long Sleeve Drawstring Hoodie,sports & fitness,Yoga,https://m.media-amazon.com/images/I/31bTxk0qHnL._AC_UL320_.jpg,https://www.amazon.in/LITINSHA-CREATION-Sweatshirts-Drawstring-Butterfly/dp/B0BLHSLQM4/ref=sr_1_3966?qid=1679217908&s=sports&sr=1-3966,1.0,1,₹699,"₹1,299"
Adidas Mens Brazil Tt Track Top,sports & fitness,Yoga,https://m.media-amazon.com/images/I/61wAgr6lD9L._AC_UL320_.jpg,https://www.amazon.in/Adidas-Mens-Brazil-Track-Hn0914_M/dp/B09N372DSP/ref=sr_1_3967?qid=1679217908&s=sports&sr=1-3967,,,,"₹4,999"
Colors & Blends - Men's Cotton Hoodie,sports & fitness,Yoga,https://m.media-amazon.com/images/I/91G6t630YlL._AC_UL320_.jpg,https://www.amazon.in/Colors-Blends-Cotton-Hoodie-Mellange/dp/B09LM8BPRK/ref=sr_1_3968?qid=1679217908&s=sports&sr=1-3968,,,₹999,"₹1,999"
Kalt Men's Half Sleeves Dual Colour Cotton Blend Hoodie(Black::Red),sports & fitness,Yoga,https://m.media-amazon.com/images/I/61K1ZzOQeWL._AC_UL320_.jpg,https://www.amazon.in/Kalt-Sleeves-Colour-Cotton-Hoodie/dp/B08CC819GL/ref=sr_1_3969?qid=1679217908&s=sports&sr=1-3969,3.5,4,₹499,"₹1,000"
"Toodlegram Plush Fleece Loop Knit Hoodie | Plus Size | Graphic Printed, Long Sleeve Drawstring Pocket Casual, Never Settle...",sports & fitness,Yoga,https://m.media-amazon.com/images/I/51yrgkYBnKL._AC_UL320_.jpg,https://www.amazon.in/Toodlegram-Graphic-Printed-Drawstring-Breathable/dp/B0BQ3NCH4P/ref=sr_1_3970?qid=1679217908&s=sports&sr=1-3970,,,"₹1,999","₹2,299"
ENNOBLE Men TIE DYE Premium Combed Cotton Hooded Sweatshirt Hoodie Multicolored,sports & fitness,Yoga,https://m.media-amazon.com/images/I/5102f-+tGGL._AC_UL320_.jpg,https://www.amazon.in/ENNOBLE-Premium-Combed-Sweatshirt-Multicolored/dp/B0B73W3G2N/ref=sr_1_3971?qid=1679217908&s=sports&sr=1-3971,,,"₹1,499","₹1,999"
A to Z Creation Printed Unisex Hooded Sweatshirt,sports & fitness,Yoga,https://m.media-amazon.com/images/I/41vHOKCB0RL._AC_UL320_.jpg,https://www.amazon.in/Creation-Printed-Fleece-Hooded-Hoodie/dp/B09SHTH7K8/ref=sr_1_3972?qid=1679217908&s=sports&sr=1-3972,2.7,3,₹580,₹899
ADRO Men's Graphic Printed Hooded Neck Hoodies Cotton Sweatshirts,sports & fitness,Yoga,https://m.media-amazon.com/images/I/61PD56BnEfL._AC_UL320_.jpg,https://www.amazon.in/ADRO-Graphic-Printed-Hoodies-Sweatshirts/dp/B09HKTFV8R/ref=sr_1_3973?qid=1679217908&s=sports&sr=1-3973,4.0,62,₹849,"₹2,799"
Vegas Girl Viscose Leggings,sports & fitness,Yoga,https://m.media-amazon.com/images/I/61m89UzEzGS._AC_UL320_.jpg,https://www.amazon.in/Vegas-Girl-Viscose-Leggings-Black/dp/B0987K85DH/ref=sr_1_3974?qid=1679217908&s=sports&sr=1-3974,,,,₹349
ADRO Men's And Women's Cotton Engineering Design Printed Hooded Neck Hoodie Sweatshirt,sports & fitness,Yoga,https://m.media-amazon.com/images/I/61teCzar1XL._AC_UL320_.jpg,https://www.amazon.in/ADRO-Engineering-Design-Printed-Sweatshirt/dp/B08H5KQVYY/ref=sr_1_3975?qid=1679217908&s=sports&sr=1-3975,3.9,32,₹849,"₹2,799"
G-Giysi Men's Regular Fit Shorts with Pocket Polyester Fitness Fashion Gym Workout Shorts for Men Training Running Athleti...,sports & fitness,Yoga,https://m.media-amazon.com/images/I/316uuEU8YYL._AC_UL320_.jpg,https://www.amazon.in/G-Giysi-Polyester-Training-Athletic-Weightlifting/dp/B0BW7R1HHB/ref=sr_1_3976?qid=1679217908&s=sports&sr=1-3976,,,₹399,"₹1,999"
Puma Men T-Shirt,sports & fitness,Yoga,https://m.media-amazon.com/images/I/51Fs2YooMFL._AC_UL320_.jpg,https://www.amazon.in/Puma-Solid-Regular-T-Shirt-53565839_Tangerine/dp/B0B7RXLXWZ/ref=sr_1_3977?qid=1679217908&s=sports&sr=1-3977,5.0,1,,
"JOSH DANIEL Regular Fit, Mens Sweatshirt with Zip Front, Hoodie, ColorMulti Colour - DC21-SSLZ83",sports & fitness,Yoga,https://m.media-amazon.com/images/I/61IMjzKWekL._AC_UL320_.jpg,https://www.amazon.in/JOSH-DANIEL-Regular-Sweatshirt-ColorMulti/dp/B09N2L3PWB/ref=sr_1_3978?qid=1679217908&s=sports&sr=1-3978,4.1,4,₹891,"₹2,999"
"PowerMax Fitness 4mm thick Premium Exercise Grey Colour Yoga Mat, Ultra-Dense Cushioning for Support and Stability in Yog...",sports & fitness,Yoga,https://m.media-amazon.com/images/I/71qGILahAOL._AC_UL320_.jpg,https://www.amazon.in/PowerMax-Fitness-Ultra-Dense-Cushioning-Eco-Friendly/dp/B09MQQ1PL6/ref=sr_1_3979?qid=1679217908&s=sports&sr=1-3979,3.7,27,₹427.83,"₹1,400"
BAGHADBILLO Unisex Stylish Latest Printed Pullover Cotton Hoodies Sweatshirt for Men and Women,sports & fitness,Yoga,https://m.media-amazon.com/images/I/61cdJ8oiwiL._AC_UL320_.jpg,https://www.amazon.in/BAGHADBILLO-Cotton-Hoodies-BB-Sleeveless-Hoodies_Red_Medium/dp/B08MB9JZ4S/ref=sr_1_3980?qid=1679217908&s=sports&sr=1-3980,2.9,31,₹399,"₹2,499"
Nike Boys Shorts,sports & fitness,Yoga,https://m.media-amazon.com/images/I/81jqXy9MnYL._AC_UL320_.jpg,https://www.amazon.in/Nike-Dri-FIT-Printed-Polyester-86F960-U89_Game/dp/B087G5C6V4/ref=sr_1_3981?qid=1679217908&s=sports&sr=1-3981,,,,
Nivia City Polo Polyester Training T-Shirt,sports & fitness,Yoga,https://m.media-amazon.com/images/I/61wF+P+pnoL._AC_UL320_.jpg,https://www.amazon.in/Nivia-2374L1-City-Polo-Polyester/dp/B07KJQ3WCM/ref=sr_1_3982?qid=1679217908&s=sports&sr=1-3982,4.3,9,₹509,₹710
NOTWILD Kids Girls Boys Plain Black Hoodies Sweatshirt Pullover Sweatshirt Fleece Hooded Jumper Coats Winter Warm Shirts A...,sports & fitness,Yoga,https://m.media-amazon.com/images/I/51M4BOKxFDL._AC_UL320_.jpg,https://www.amazon.in/NOTWILD-Hoodies-Sweatshirt-Pullover-Fleece/dp/B0B787T657/ref=sr_1_3983?qid=1679217908&s=sports&sr=1-3983,3.9,14,₹699,"₹1,499"
Narsingha Dreams Women's Polycotton Summer Crop Top Printed Hoodie,sports & fitness,Yoga,https://m.media-amazon.com/images/I/41nLQatUq1L._AC_UL320_.jpg,https://www.amazon.in/Narsingha-Dreams-Womens-Polycotton-Printed/dp/B09TGWHBMZ/ref=sr_1_3984?qid=1679217908&s=sports&sr=1-3984,3.7,2,₹399,₹999
PERSONALITEE Pocket Avengers Logo Printed Cotton Blend Regular Fit Hoodie,sports & fitness,Yoga,https://m.media-amazon.com/images/I/41IiNBMdg5L._AC_UL320_.jpg,https://www.amazon.in/PERSONALITEE-Pocket-Avengers-Printed-Regular/dp/B0BQYK9X99/ref=sr_1_4465?qid=1679217915&s=sports&sr=1-4465,,,₹599,₹999
MOONSHINE Shree Chintransh Creations Printed Hoodies for Boys and Girls,sports & fitness,Yoga,https://m.media-amazon.com/images/I/51dN-y-8PqL._AC_UL320_.jpg,https://www.amazon.in/MOONSHINE-Chintransh-Creations-Printed-Hoodies/dp/B0BPHFBDBH/ref=sr_1_4466?qid=1679217915&s=sports&sr=1-4466,,,₹999,"₹1,599"
Bewakoof Men's Super Loose Typography Green Full Sleeves Hoodie,sports & fitness,Yoga,https://m.media-amazon.com/images/I/41FFJqCcYVL._AC_UL320_.jpg,https://www.amazon.in/Bewakoof-Super-Typography-Sleeves-Hoodie/dp/B0BN7S4NP8/ref=sr_1_4467?qid=1679217915&s=sports&sr=1-4467,Get,FREE Delivery by Amazon,₹896,"₹3,399"
Li-Ning Badminton Round Neck Tshirt,sports & fitness,Yoga,https://m.media-amazon.com/images/I/61-BFGQJG9L._AC_UL320_.jpg,https://www.amazon.in/Li-Ning-Badminton-Round-Neck-Tshirt/dp/B09SBPZ9N3/ref=sr_1_4468?qid=1679217915&s=sports&sr=1-4468,4.0,2,₹599,₹799
"BLIVE Full Sleeve Printed Men's Hooded Sweatshirt | Hoodies (Red-Black, Large)",sports & fitness,Yoga,https://m.media-amazon.com/images/I/61YyPMhbKNL._AC_UL320_.jpg,https://www.amazon.in/BLIVE-Printed-Sweatshirt-Hoodies-Red-Black/dp/B09LV61VMQ/ref=sr_1_4469?qid=1679217915&s=sports&sr=1-4469,3.2,5,₹499,"₹2,499"
