name,main_category,sub_category,image,link,ratings,no_of_ratings,discount_price,actual_price
Charged Energy-004 Interlock Knit Hexagon Emboss Round Neck Sports T-Shirt Grape-Green Size Large And Charged Play-005 Int...,sports & fitness,Yoga,https://m.media-amazon.com/images/W/IMAGERENDERING_521856-T1/images/I/810pYxE9+rL._AC_UL320_.jpg,https://www.amazon.in/Energy-004-Interlock-Grape-Green-Play-005-Geomatric/dp/B098P751ZF/ref=sr_1_6889?qid=1679217954&s=sports&sr=1-6889,,,,"₹1,048"
Charged Energy-004 Interlock Knit Hexagon Emboss Round Neck Sports T-Shirt Red Size Xl And Charged Play-005 Interlock Knit...,sports & fitness,Yoga,https://m.media-amazon.com/images/W/IMAGERENDERING_521856-T1/images/I/812wHOauWwL._AC_UL320_.jpg,https://www.amazon.in/Energy-004-Interlock-Play-005-Geomatric-Dark-Grey/dp/B098P71FTH/ref=sr_1_6890?qid=1679217954&s=sports&sr=1-6890,,,,"₹1,048"
Charged Play-005 Interlock Knit Geomatric Emboss Round Neck Sports T-Shirt Dark-Grey Size Medium And Charged Pulse-006 Che...,sports & fitness,Yoga,https://m.media-amazon.com/images/W/IMAGERENDERING_521856-T1/images/I/81mOruJm52L._AC_UL320_.jpg,https://www.amazon.in/Interlock-Geomatric-Polyester-Dark-Grey-Pulse-006/dp/B098P6KK47/ref=sr_1_6891?qid=1679217954&s=sports&sr=1-6891,,,,₹998
Charged Energy-004 Interlock Knit Hexagon Emboss Round Neck Sports T-Shirt Black Size Xl And Charged Play-005 Interlock Kn...,sports & fitness,Yoga,https://m.media-amazon.com/images/W/IMAGERENDERING_521856-T1/images/I/71PJvEbZzwL._AC_UL320_.jpg,https://www.amazon.in/Charged-Energy-004-Interlock-Play-005-Geomatric/dp/B098P6KHMP/ref=sr_1_6892?qid=1679217954&s=sports&sr=1-6892,,,₹851,"₹1,048"
Charged Brisk-002 Melange Round Neck Sports T-Shirt Red Size Small And Charged Pulse-006 Checker Knitt Round Neck Sports ...,sports & fitness,Yoga,https://m.media-amazon.com/images/W/IMAGERENDERING_521856-T1/images/I/819+5DlDcQL._AC_UL320_.jpg,https://www.amazon.in/Charged-Brisk-002-Melange-T-Shirt-Pulse-006/dp/B098P62H6D/ref=sr_1_6893?qid=1679217954&s=sports&sr=1-6893,,,,"₹1,098"
Charged Endure-003 Chameleon Spandex Knit Round Neck Sports T-Shirt Light-Grey Size Xl And Charged Play-005 Interlock Knit...,sports & fitness,Yoga,https://m.media-amazon.com/images/W/IMAGERENDERING_521856-T1/images/I/81mxRaj6kGL._AC_UL320_.jpg,https://www.amazon.in/Endure-003-Chameleon-Light-Grey-Interlock-Geomatric/dp/B098P5ZSCQ/ref=sr_1_6894?qid=1679217954&s=sports&sr=1-6894,,,"₹1,012","₹1,148"
Charged Brisk-002 Melange Polyester Round Neck Sports T-Shirt Red Size Medium And Energy-004 Interlock Knit Hexagon Emboss...,sports & fitness,Yoga,https://m.media-amazon.com/images/W/IMAGERENDERING_521856-T1/images/I/81NEeZFFTTL._AC_UL320_.jpg,https://www.amazon.in/Charged-Brisk-002-Polyester-Energy-004-Interlock/dp/B098P5V5YX/ref=sr_1_6895?qid=1679217954&s=sports&sr=1-6895,,,,"₹1,148"
Charged Brisk-002 Melange Round Neck Sports T-Shirt Rust Size Small And Charged Energy-004 Interlock Knit Hexagon Emboss R...,sports & fitness,Yoga,https://m.media-amazon.com/images/W/IMAGERENDERING_521856-T1/images/I/81Irqt3LPEL._AC_UL320_.jpg,https://www.amazon.in/Charged-Brisk-002-Melange-Energy-004-Interlock/dp/B098P4QTS7/ref=sr_1_6896?qid=1679217954&s=sports&sr=1-6896,,,,"₹1,148"
Nike Men AS M NK DF ACD21 Short K,sports & fitness,Yoga,https://m.media-amazon.com/images/W/IMAGERENDERING_521856-T1/images/I/91BP2C2PZkS._AC_UL320_.jpg,https://www.amazon.in/Nike-Regular-Synthetic-CW6108-451_Obsidian-White_S/dp/B097F19SBQ/ref=sr_1_6897?qid=1679217954&s=sports&sr=1-6897,,,,₹995
More & More Dancing Panda Printed Unisex Hoodie | Pullover Sweatshirt | Warm Hoodie,sports & fitness,Yoga,https://m.media-amazon.com/images/W/IMAGERENDERING_521856-T1/images/I/71lqSS44bbS._AC_UL320_.jpg,https://www.amazon.in/More-Unisex-Adult-Dancing-Printed-Yellow-M_Yellow_M/dp/B0977DB5G2/ref=sr_1_6898?qid=1679217954&s=sports&sr=1-6898,3.9,271,₹799,"₹2,499"
More & More Dancing Panda Printed Unisex Hoodie | Pullover Sweatshirt | Warm Hoodie,sports & fitness,Yoga,https://m.media-amazon.com/images/W/IMAGERENDERING_521856-T1/images/I/71lqSS44bbS._AC_UL320_.jpg,https://www.amazon.in/More-Unisex-Adult-Dancing-Printed-Yellow-XL_Yellow_XL/dp/B0977CB8GH/ref=sr_1_6899?qid=1679217954&s=sports&sr=1-6899,3.9,271,₹799,"₹2,499"
ARCHIE HOME PRESENTS YOGA MEN WOMEN ANTI SKID WATERPROOF 2 FEET X 6 FEET 6MM MULTICOLOUR,sports & fitness,Yoga,https://m.media-amazon.com/images/W/IMAGERENDERING_521856-T1/images/I/413ozXaaU1S._AC_UL320_.jpg,https://www.amazon.in/ARCHIE-HOME-PRESENTS-WATERPROOF-MULTICOLOUR/dp/B096Z5HFXZ/ref=sr_1_6900?qid=1679217954&s=sports&sr=1-6900,3.5,11,₹299,"₹1,199"
Nike Women's Polyester Hooded Neck Sweatshirt,sports & fitness,Yoga,https://m.media-amazon.com/images/W/IMAGERENDERING_521856-T1/images/I/31TAYP--0ZL._AC_UL320_.jpg,https://www.amazon.in/Nike-Hoodie-Femme-GFX_Beyond-Black_CZ1886-680-M/dp/B096FBQLYL/ref=sr_1_6901?qid=1679217954&s=sports&sr=1-6901,5.0,1,"₹2,109","₹3,695"
"VINO Compression Half Tight Plain Athletic Fit Multi Sports Cycling, Cricket, Football, Badminton, Gym, Fitness & Other Ou...",sports & fitness,Yoga,https://m.media-amazon.com/images/W/IMAGERENDERING_521856-T1/images/I/51uZoF9seoS._AC_UL320_.jpg,https://www.amazon.in/VINO-Compression-Athletic-Football-Badminton/dp/B094RV3475/ref=sr_1_6902?qid=1679217954&s=sports&sr=1-6902,4.0,1,₹249,₹349
2MGL Compression Skin Tights Base Layer Non-Padded Unisex Half Shorts Plain Black,sports & fitness,Yoga,https://m.media-amazon.com/images/W/IMAGERENDERING_521856-T1/images/I/41nSK5Nd8KL._AC_UL320_.jpg,https://www.amazon.in/Compression-Tights-Non-Padded-Unisex-Shorts/dp/B08ZJ98QRT/ref=sr_1_6903?qid=1679217954&s=sports&sr=1-6903,4.1,19,₹166,₹555
"Shape-X Men's Cotton Shorts for Gym, Yoga, Exercise, Cycling (Red, White, Red) - Combo of 2",sports & fitness,Yoga,https://m.media-amazon.com/images/W/IMAGERENDERING_521856-T1/images/I/71OAUTIHO9S._AC_UL320_.jpg,https://www.amazon.in/Mens-Cotton-Shorts-Exercise-Cycling/dp/B08XPB2W4C/ref=sr_1_6904?qid=1679217954&s=sports&sr=1-6904,3.8,13,₹598,"₹1,999"
JUST RIDER Womens Track Suit,sports & fitness,Yoga,https://m.media-amazon.com/images/W/IMAGERENDERING_521856-T1/images/I/41FPOkTf2hS._AC_UL320_.jpg,https://www.amazon.in/JUST-RIDER-Mens-Track-Black/dp/B08WQ9G2T4/ref=sr_1_6905?qid=1679217954&s=sports&sr=1-6905,4.1,22,₹698,₹999
Goodtry G Men's Cotton Printed Hoodies Combo 2 Multicolour,sports & fitness,Yoga,https://m.media-amazon.com/images/W/IMAGERENDERING_521856-T1/images/I/81r+DnoiU3L._AC_UL320_.jpg,https://www.amazon.in/Goodtry-Cotton-Printed-Hoodies-Multicolour/dp/B08RXVZYRQ/ref=sr_1_6906?qid=1679217954&s=sports&sr=1-6906,3.6,6,₹999,"₹1,999"
BAGHADBILLO Unisex Stylish Latest Printed Pullover Cotton Hoodies Sweatshirt for Men and Women,sports & fitness,Yoga,https://m.media-amazon.com/images/W/IMAGERENDERING_521856-T1/images/I/61QPvp7SktL._AC_UL320_.jpg,https://www.amazon.in/BAGHADBILLO-Unisex-Hoodies-PINK-40_Baby-Pink_Medium/dp/B08R9R2LRM/ref=sr_1_6907?qid=1679217954&s=sports&sr=1-6907,3.8,227,₹799,"₹2,499"
House of Queens Chic Elegant Natural Rubber+Eco Print Microfiber Yoga Mat. Ideal to absorbe Sweat. Excellent Grip on Floo...,sports & fitness,Yoga,https://m.media-amazon.com/images/W/IMAGERENDERING_521856-T1/images/I/712VbAdvonL._AC_UL320_.jpg,https://www.amazon.in/House-Queens-Natural-Rubber-Microfiber/dp/B08L8FL12Z/ref=sr_1_6908?qid=1679217954&s=sports&sr=1-6908,4.4,66,"₹1,550","₹3,999"
Game Begins Boys Fleece Jacket,sports & fitness,Yoga,https://m.media-amazon.com/images/W/IMAGERENDERING_521856-T1/images/I/91jcRinfRdS._AC_UL320_.jpg,https://www.amazon.in/Game-Begins-Superman-Sweatshirt-GBS32730XXBSWT_Black_24/dp/B08GCTH5L7/ref=sr_1_6909?qid=1679217954&s=sports&sr=1-6909,3.2,5,₹326,₹549
"The SV Style Men's, Women's, Cotton, High Neck, Pocket, Mickey Graphic Printed Warm Hoodie (White, Black)",sports & fitness,Yoga,https://m.media-amazon.com/images/W/IMAGERENDERING_521856-T1/images/I/31cWMDmCVHL._AC_UL320_.jpg,https://www.amazon.in/SV-Style-Unisex-White-Hoodie/dp/B08BXW6JKF/ref=sr_1_6910?qid=1679217954&s=sports&sr=1-6910,4.6,19,₹899,"₹1,500"
The SV Style Unisex Maroon Hoodie with White Print:Cute AF/Printed Maroon Hoodie/Graphic Printed Hoodie/Hoodie for Men & W...,sports & fitness,Yoga,https://m.media-amazon.com/images/W/IMAGERENDERING_521856-T1/images/I/41b8f9XbIlL._AC_UL320_.jpg,https://www.amazon.in/SV-Style-Unisex-Maroon-Hoodie/dp/B089GNPY8N/ref=sr_1_6911?qid=1679217954&s=sports&sr=1-6911,4.1,31,₹799,"₹1,500"
"Blisstone Men's Cotton Hooded T-Shirt (Medium, Grey::Maroon)",sports & fitness,Yoga,https://m.media-amazon.com/images/W/IMAGERENDERING_521856-T1/images/I/61-gMffzmiL._AC_UL320_.jpg,https://www.amazon.in/Blisstone-Cotton-Hooded-T-Shirt-Medium/dp/B084HGK9S5/ref=sr_1_6912?qid=1679217954&s=sports&sr=1-6912,3.9,20,₹399,₹999
Fusefit Women Hooded Sweatshirt,sports & fitness,Yoga,https://m.media-amazon.com/images/I/71gZ-zcDv6L._AC_UL320_.jpg,https://www.amazon.in/Fusefit-Casual-AIRFORCE-Sweatshirt-FFA-WT044-03-L-1199/dp/B09CDGP3YH/ref=sr_1_7417?qid=1679217962&s=sports&sr=1-7417,3.7,9,₹359,"₹1,199"
Charged Brisk-002 Melange Polyester Round Neck Sports T-Shirt Red Size 2Xl And Pulse-006 Checker Knitt Polyester Round Nec...,sports & fitness,Yoga,https://m.media-amazon.com/images/I/81P1+e8spxL._AC_UL320_.jpg,https://www.amazon.in/Charged-Brisk-002-Melange-Polyester-Pulse-006/dp/B098PB43CV/ref=sr_1_7418?qid=1679217962&s=sports&sr=1-7418,,,₹287.81,"₹1,098"
Charged Play-005 Interlock Knit Geomatric Emboss Round Neck Sports T-Shirt Navy Size Small And Charged Pulse-006 Checker K...,sports & fitness,Yoga,https://m.media-amazon.com/images/I/81kmrVoWOaL._AC_UL320_.jpg,https://www.amazon.in/Play-005-Interlock-Geomatric-Pulse-006-Graphite/dp/B098P61TQS/ref=sr_1_7419?qid=1679217962&s=sports&sr=1-7419,,,₹241.34,₹998
00RA WITH AS LOGO Men's Sports Gym Shorts (Free Size-28-34 Inches Waist),sports & fitness,Yoga,https://m.media-amazon.com/images/I/71TGwH8VtNS._AC_UL320_.jpg,https://www.amazon.in/00RA-AS-LOGO-Darkblue-Grey-Size-28-34/dp/B097PW7BFX/ref=sr_1_7420?qid=1679217962&s=sports&sr=1-7420,3.8,13,₹439,₹999
SlimFit Yoga Mat |Meditation| For Fitness Lover Men Women and Kids | Anti Skid | Anti Slip | Multicolour 4 MM| Waterproof...,sports & fitness,Yoga,https://m.media-amazon.com/images/I/51nGFjOpvYS._AC_UL320_.jpg,https://www.amazon.in/SlimFit-Meditation-Multicolour-Waterproof-Multipurpose/dp/B096QH54Q1/ref=sr_1_7421?qid=1679217962&s=sports&sr=1-7421,3.1,10,₹299,"₹1,499"
Amazon Brand - Symactive Men's Activewear Gym Shorts (SYSP-07_Deep Red + Opal Blue_XL),sports & fitness,Yoga,https://m.media-amazon.com/images/I/71wCE8c74rL._AC_UL320_.jpg,https://www.amazon.in/Amazon-Brand-Symactive-Polyester-SYSP-07_Mid/dp/B093DK3JVC/ref=sr_1_7422?qid=1679217962&s=sports&sr=1-7422,4.6,3,₹691.64,"₹2,399"
Amazon Brand - Symactive Men's Activewear Gym Shorts (SYSP-07_Deep Red + Opal Blue_M),sports & fitness,Yoga,https://m.media-amazon.com/images/I/81iG+0w0sML._AC_UL320_.jpg,https://www.amazon.in/Amazon-Brand-Symactive-Shorts-Mid-Black-Medium/dp/B093DJZ2X6/ref=sr_1_7423?qid=1679217962&s=sports&sr=1-7423,5.0,1,₹655.04,"₹2,399"
GymCraft Men's Polyester Blend Hooded Neck Hoodie,sports & fitness,Yoga,https://m.media-amazon.com/images/I/81zZDLjtZQL._AC_UL320_.jpg,https://www.amazon.in/GymCraft-Printed-Hoodie-Sweatshirt-X-Large/dp/B08TVQ7TVP/ref=sr_1_7424?qid=1679217962&s=sports&sr=1-7424,3.5,15,₹889,"₹1,499"
checkersbay Hooded Solid Girls Sweatshirt,sports & fitness,Yoga,https://m.media-amazon.com/images/I/61haKJz4z8L._AC_UL320_.jpg,https://www.amazon.in/checkersbay-Hooded-Solid-Girls-Sweatshirt/dp/B08TM7W8K5/ref=sr_1_7425?qid=1679217962&s=sports&sr=1-7425,3.2,100,₹508,"₹1,098"
"Alfaq BE Hoodie for Men & Women (M, Black)",sports & fitness,Yoga,https://m.media-amazon.com/images/I/61R0DmqeDSL._AC_UL320_.jpg,https://www.amazon.in/Alfaq-Billie-Eilish-hoodie-women/dp/B08R7C8RYH/ref=sr_1_7426?qid=1679217962&s=sports&sr=1-7426,4.6,7,₹999,"₹1,999"
Vogueorgy Cool and Trendy EXO Hoodie for Men,sports & fitness,Yoga,https://m.media-amazon.com/images/I/61LOZmV2QZL._AC_UL320_.jpg,https://www.amazon.in/Vogueorgy-Cool-Trendy-Hoodie-XXX-Large/dp/B08PFTCP7W/ref=sr_1_7427?qid=1679217962&s=sports&sr=1-7427,3.7,35,₹849,"₹1,499"
Kalt Men's Full Sleeves Zipper Fleece Striped Hoodie(Navy::White::Red),sports & fitness,Yoga,https://m.media-amazon.com/images/I/61ZxYFAHzfL._AC_UL320_.jpg,https://www.amazon.in/Kalt-Sleeves-Zipper-Fleece-Striped/dp/B08LSPN1JJ/ref=sr_1_7428?qid=1679217962&s=sports&sr=1-7428,4.2,21,₹899,"₹1,700"
Diverse Men Front Zipper Hooded Sweatshirt,sports & fitness,Yoga,https://m.media-amazon.com/images/I/814uXe7lE1L._AC_UL320_.jpg,https://www.amazon.in/Diverse-Mens-Cotton-Knitwear-DCMSSF08RC19L35-4275F_Olive_L/dp/B08JJ63FND/ref=sr_1_7429?qid=1679217962&s=sports&sr=1-7429,3.7,15,₹699,"₹1,999"
"IRIS Yoga Knee Pad - Kneeling Support for Yoga, Eco-Friendly & Lightweight Yoga Knee Pads Cushion for Knees, Hands, Wrist...",sports & fitness,Yoga,https://m.media-amazon.com/images/I/51RQE5xxs2L._AC_UL320_.jpg,https://www.amazon.in/IRIS-Yoga-Knee-Pad-Eco-Friendly/dp/B08JGY4WWV/ref=sr_1_7430?qid=1679217962&s=sports&sr=1-7430,3.4,2,"₹1,499","₹3,000"
BLIVE Full Sleeve Color Block Printed Boys Hooded Sweatshirt Maroon Grey | Hoodies,sports & fitness,Yoga,https://m.media-amazon.com/images/I/51M3fMtnPPL._AC_UL320_.jpg,https://www.amazon.in/BLIVE-Sleeve-Printed-Sweatshirt-Hoodies/dp/B08GR63QWP/ref=sr_1_7431?qid=1679217962&s=sports&sr=1-7431,3.6,507,₹429,"₹1,999"
Miss Olive Women Sweatshirt,sports & fitness,Yoga,https://m.media-amazon.com/images/I/81rLszRmWHL._AC_UL320_.jpg,https://www.amazon.in/Miss-Olive-Womens-Sweatshirt-MOAW19SWT01-90-143-03/dp/B08D3SSYQW/ref=sr_1_7432?qid=1679217962&s=sports&sr=1-7432,4.0,18,₹709,"₹1,999"
"Nivia 8829 Cotton Stripes Socks, Anklet (Multicolor)",sports & fitness,Yoga,https://m.media-amazon.com/images/I/31XSLPQQxXL._AC_UL320_.jpg,https://www.amazon.in/Nivia-8829-Cotton-Stripes-Multicolor/dp/B08C8954SD/ref=sr_1_7433?qid=1679217962&s=sports&sr=1-7433,3.0,2,₹233,₹289
"Bluebird Fashion Yoga Mat High Density, Anti-Slip Yoga mat for Gym Workout and Flooring Exercise Long Size. 4 mm Yoga Mat ...",sports & fitness,Yoga,https://m.media-amazon.com/images/I/61OPowfF1eL._AC_UL320_.jpg,https://www.amazon.in/Bluebird-Fashion-Anti-Slip-Flooring-Exercise/dp/B08BXL62T1/ref=sr_1_7434?qid=1679217962&s=sports&sr=1-7434,3.0,36,,₹310
PUMA Women's Cape Coat (530078 Black_M),sports & fitness,Yoga,https://m.media-amazon.com/images/I/71rvmq8A3GL._AC_UL320_.jpg,https://www.amazon.in/PUMA-Iconic-Womens-Track-Jacket/dp/B08B3PTCDM/ref=sr_1_7435?qid=1679217962&s=sports&sr=1-7435,Get,FREE Delivery by Amazon,"₹2,119","₹3,999"
Puma Men's' Regular T-Shirt,sports & fitness,Yoga,https://m.media-amazon.com/images/I/71C4P9BvonL._AC_UL320_.jpg,https://www.amazon.in/Puma-Printed-Regular-65673501_Chili-Pepper-Cordovan-Red/dp/B089Z8RQG8/ref=sr_1_7436?qid=1679217962&s=sports&sr=1-7436,4.3,137,"₹1,679","₹2,299"
"Kk Home Store Decor Yoga Mat High Density, Anti-Slip Yoga mat for Gym Workout and Flooring Exercise Long Size. 4 mm Yoga M...",sports & fitness,Yoga,https://m.media-amazon.com/images/I/419SyPhvhmL._AC_UL320_.jpg,https://www.amazon.in/Kk-Home-Store-Decor-Multicolor/dp/B08921V9LG/ref=sr_1_7437?qid=1679217962&s=sports&sr=1-7437,4.0,7,₹500,"₹1,200"
"ASE YOGA INDIA Organic and Eco Friendly Cotton Yoga Mat (61X183 cm, 5 mm Thick, Navy Blue and Green",sports & fitness,Yoga,https://m.media-amazon.com/images/I/619-zh2ZEXL._AC_UL320_.jpg,https://www.amazon.in/ASE-YOGA-INDIA-Organic-Friendly/dp/B082WYCH4G/ref=sr_1_7438?qid=1679217962&s=sports&sr=1-7438,4.2,14,₹849,"₹1,399"
FUNKY MONKEY Unisex Black Solid Hoodie XL,sports & fitness,Yoga,https://m.media-amazon.com/images/I/31u6-51wDnL._AC_UL320_.jpg,https://www.amazon.in/Funky-Monkey-Unisex-Black-Hoodie/dp/B0824N3V46/ref=sr_1_7439?qid=1679217962&s=sports&sr=1-7439,3.8,16,₹699,"₹1,299"
Puma Men's Jacket,sports & fitness,Yoga,https://m.media-amazon.com/images/I/61vehNLsOhL._AC_UL320_.jpg,https://www.amazon.in/Puma-Track-Jacket-58213138_Gibraltar-Heather_Medium/dp/B07VGB9T3Y/ref=sr_1_7440?qid=1679217962&s=sports&sr=1-7440,3.8,5,"₹1,679","₹2,799"
Monte Carlo Women Cardigan Sweater,sports & fitness,Yoga,https://m.media-amazon.com/images/I/71KVN7rrq3L._AC_UL320_.jpg,https://www.amazon.in/Monte-Carlo-Sleeve-Sweatshirt-Womens/dp/B0B7ML2493/ref=sr_1_7561?qid=1679217965&s=sports&sr=1-7561,Get,FREE Delivery by Amazon,"₹2,558","₹2,595"
TC TAKESHI CREATIONS Women's & Girl's Sports Lower for Yoga Gym & Cycling,sports & fitness,Yoga,https://m.media-amazon.com/images/I/61JKxequYeL._AC_UL320_.jpg,https://www.amazon.in/TC-TAKESHI-CREATIONS-Womens-Cycling/dp/B0B4KGBSNG/ref=sr_1_7562?qid=1679217965&s=sports&sr=1-7562,4.5,2,₹599,"₹1,198"
INDISSH Unisex Regular Cotton Anime Front & Back Graphic Printed Hoodie|(BH02)|,sports & fitness,Yoga,https://m.media-amazon.com/images/I/51jGq9w1xBL._AC_UL320_.jpg,https://www.amazon.in/INDISSH-Unisex-Regular-Graphic-Printed/dp/B09XLNNFDT/ref=sr_1_7563?qid=1679217965&s=sports&sr=1-7563,,,₹958,"₹1,299"
"STYLEAONE Self Design Women's Night Shorts, Gym Shorts, Cycling Shorts, Running Shorts, Sports Shorts, Yoga Shorts",sports & fitness,Yoga,https://m.media-amazon.com/images/I/413aiVMzVkL._AC_UL320_.jpg,https://www.amazon.in/STYLEAONE-Design-Womens-Cycling-Running/dp/B09TP4SLQY/ref=sr_1_7564?qid=1679217965&s=sports&sr=1-7564,,,₹275,₹799
Jumprfit Yoga mat for Women and Men with Cover Bag High Foaming Material 6-mm Extra Thick Exercise mat for Workout Yoga Fi...,sports & fitness,Yoga,https://m.media-amazon.com/images/I/41WpmoUeUaL._AC_UL320_.jpg,https://www.amazon.in/Jumprfit-Foaming-Material-Exercise-Meditation/dp/B09T2Z2G8D/ref=sr_1_7565?qid=1679217965&s=sports&sr=1-7565,,,"₹1,349","₹1,499"
The Veshti Company Men's Premium Low Crotch Loose Boho Yoga Harem Pants,sports & fitness,Yoga,https://m.media-amazon.com/images/I/71dh1U7dAJL._AC_UL320_.jpg,https://www.amazon.in/Premium-crotch-Loose-Harem-Grey-White/dp/B09SVHZD86/ref=sr_1_7566?qid=1679217965&s=sports&sr=1-7566,4.2,182,"₹1,999","₹3,000"
"Puma Men nu-tility fz Hoodie Black, (67160901-m)",sports & fitness,Yoga,https://m.media-amazon.com/images/I/51wIEyzuJDL._AC_UL320_.jpg,https://www.amazon.in/Puma-nu-tility-Hoodie-Black-67160901-m/dp/B09S6HFV3G/ref=sr_1_7567?qid=1679217965&s=sports&sr=1-7567,,,"₹2,369","₹4,999"
VAMON Compression Tight for Men and Boys for Running Exercise Black Short,sports & fitness,Yoga,https://m.media-amazon.com/images/I/411A1DsfZ0L._AC_UL320_.jpg,https://www.amazon.in/VAMON-Compression-Tight-Running-Exercise/dp/B09QZPT8WS/ref=sr_1_7568?qid=1679217965&s=sports&sr=1-7568,,,₹247,₹799
Darkbuck® Hoodies for Men and Women Naruto Itachi Akatsuki Village Anime Hoodie Unisex Pure Cotton Casual Wear Sweatshirt,sports & fitness,Yoga,https://m.media-amazon.com/images/I/51jbxII3nqL._AC_UL320_.jpg,https://www.amazon.in/Darkbuck%C2%AE-Hoodies-Akatsuki-Village-Sweatshirt/dp/B09QWWTHZ5/ref=sr_1_7569?qid=1679217965&s=sports&sr=1-7569,5.0,3,"₹1,299","₹1,500"
Moa Yoga Asana Alignment Printed Eco Friendly Natural TPE Yoga Mat For Women And Men 5 mm,sports & fitness,Yoga,https://m.media-amazon.com/images/I/61-YyvwShZL._AC_UL320_.jpg,https://www.amazon.in/Moa-Yoga-Printed-Friendly-Alignment/dp/B09P8LWWQJ/ref=sr_1_7570?qid=1679217965&s=sports&sr=1-7570,4.3,3,"₹2,199","₹3,200"
Shree Chitransh Creation Joker Pro Characters Grey Cotton Fleece Round Neck Sweatshirt Hoodie for Kids Boys Girl (Black),sports & fitness,Yoga,https://m.media-amazon.com/images/I/61k3JtBk4gL._AC_UL320_.jpg,https://www.amazon.in/Chitransh-Creation-Characters-Cotton-Sweatshirt/dp/B09NTWG34Q/ref=sr_1_7571?qid=1679217965&s=sports&sr=1-7571,3.1,4,₹999,"₹1,799"
"Grip Professional Series 36 Inches x 78 Inches, 12MM Thickness, Cherry Color, 7 Chakras Design TPE Yoga Mats For Men & Women.",sports & fitness,Yoga,https://m.media-amazon.com/images/I/61jGIhzH3ML._AC_UL320_.jpg,https://www.amazon.in/Professional-Inches-Thickness-Cherry-Chakras/dp/B09LD3RF67/ref=sr_1_7572?qid=1679217965&s=sports&sr=1-7572,Get,Only 1 left in stock.,"₹3,494","₹3,999"
Girls Micky Mouse Hoodie-33,sports & fitness,Yoga,https://m.media-amazon.com/images/I/614LPZBqjyL._AC_UL320_.jpg,https://www.amazon.in/Girls-Micky-Mouse-Hoodie-33-Light/dp/B09KH61YYR/ref=sr_1_7573?qid=1679217965&s=sports&sr=1-7573,3.7,14,₹829,"₹1,599"
FASHION AND YOUTH Stylish Unisex You Had Me at Woof Design Printed Hooded Hoodies | Pullover Sweatshirts for Men & Women,sports & fitness,Yoga,https://m.media-amazon.com/images/I/41wiiNRJfwL._AC_UL320_.jpg,https://www.amazon.in/FASHION-YOUTH-Stylish-Pullover-Sweatshirts/dp/B09HXTK6NX/ref=sr_1_7574?qid=1679217965&s=sports&sr=1-7574,,,₹750,"₹1,999"
FASHION AND YOUTH Latest & Stylish Unisex BTS Bangtan Boys Design Printed Hooded Hoodies | Pullover Sweatshirts for Men & ...,sports & fitness,Yoga,https://m.media-amazon.com/images/I/71Wz1oTHMGL._AC_UL320_.jpg,https://www.amazon.in/FASHION-YOUTH-Stylish-Pullover-Sweatshirts/dp/B09GL2YR7H/ref=sr_1_7575?qid=1679217965&s=sports&sr=1-7575,3.5,14,₹750,"₹1,999"
Bon Organik Women's Cotton Hooded Neck Sweatshirt,sports & fitness,Yoga,https://m.media-amazon.com/images/I/71aUBB+SxDL._AC_UL320_.jpg,https://www.amazon.in/Bon-Organik-Hooded-Sweatshirt-BON7916/dp/B09FQ2T18T/ref=sr_1_7576?qid=1679217965&s=sports&sr=1-7576,5.0,3,₹618.46,"₹1,599"
PowerMax Fitness X Marvel Yoga Mat YP61.2 Captain America Marvel Edition Anti Skid Yoga mat with Bag for Gym Workout and F...,sports & fitness,Yoga,https://m.media-amazon.com/images/I/81w7XfaiuBL._AC_UL320_.jpg,https://www.amazon.in/PowerMax-Captain-America-Flooring-Exercise/dp/B09D8CCTN5/ref=sr_1_7577?qid=1679217965&s=sports&sr=1-7577,3.6,3,"₹1,850","₹2,100"
Fusefit Women Hooded Sweatshirt,sports & fitness,Yoga,https://m.media-amazon.com/images/I/81xiKETdF8L._AC_UL320_.jpg,https://www.amazon.in/Fusefit-Womens-Fleece-Sweatshirt-FFA-WT055-02-S-1499_Sports/dp/B09CDH6MVZ/ref=sr_1_7578?qid=1679217965&s=sports&sr=1-7578,4.4,13,₹469,"₹1,499"
Henicepte Men Slimming Tummy Control Chest Compression Hide Gynecomastia Undershirt Shapewear,sports & fitness,Yoga,https://m.media-amazon.com/images/I/61G35e-qIaL._AC_UL320_.jpg,https://www.amazon.in/Henicepte-Compression-Gynecomastia-Undershirt-Shapewear/dp/B099Z4RX1H/ref=sr_1_7579?qid=1679217965&s=sports&sr=1-7579,4.1,740,"₹3,999","₹7,000"
Puma Women's Classic Fit T Shirt,sports & fitness,Yoga,https://m.media-amazon.com/images/I/51LDsRk3bYL._AC_UL320_.jpg,https://www.amazon.in/Puma-Womens-Classic-T-Shirt-52018189_Pink/dp/B098TRCLYD/ref=sr_1_7580?qid=1679217965&s=sports&sr=1-7580,4.3,9,"₹1,259","₹1,799"
Charged Energy-004 Interlock Knit Hexagon Emboss Round Neck Sports T-Shirt Scuba Size 2XL and Charged Play-005 Interlock K...,sports & fitness,Yoga,https://m.media-amazon.com/images/I/81LpSrbxRXL._AC_UL320_.jpg,https://www.amazon.in/Energy-004-Interlock-Play-005-Geomatric-Dark-Grey/dp/B098P8SZ2Y/ref=sr_1_7581?qid=1679217965&s=sports&sr=1-7581,Get,FREE Delivery by Amazon,,"₹1,048"
MG Brand F.R.I.E.N.D.S Web Series Unisex Black Cotton Hooded Hoodie for Girls / Boys / Kids / Women / Men,sports & fitness,Yoga,https://m.media-amazon.com/images/I/51vf+yfwemS._AC_UL320_.jpg,https://www.amazon.in/MG-Brand-F-R-I-N-D-S-MG-freindshoodie3/dp/B097STXNC1/ref=sr_1_7582?qid=1679217965&s=sports&sr=1-7582,3.8,10,₹799,"₹1,599"
More & More Dancing Panda Printed Unisex Hoodie | Pullover Sweatshirt | Warm Hoodie,sports & fitness,Yoga,https://m.media-amazon.com/images/I/71zYHf7t-oS._AC_UL320_.jpg,https://www.amazon.in/More-Unisex-Adult-Dancing-Printed-Blue-L_Aqua/dp/B0977CNCWY/ref=sr_1_7583?qid=1679217965&s=sports&sr=1-7583,3.9,271,₹799,"₹2,499"
More & More Dancing Panda Printed Unisex Hoodie | Pullover Sweatshirt | Warm Hoodie,sports & fitness,Yoga,https://m.media-amazon.com/images/I/71lqSS44bbS._AC_UL320_.jpg,https://www.amazon.in/More-Unisex-Adult-Dancing-Printed-Yellow-S_Yellow_S/dp/B0977BZH72/ref=sr_1_7584?qid=1679217965&s=sports&sr=1-7584,3.9,271,₹799,"₹2,499"
Eurofil Yoga Mat Black Color 4mm Anti Skid Yoga Mat For Home And Gym Workout,sports & fitness,Yoga,https://m.media-amazon.com/images/I/41AW7zScIXL._AC_UL320_.jpg,https://www.amazon.in/Yoga-Anti-Skid-Home-Workout/dp/B09B6VK8TT/ref=sr_1_7657?qid=1679217967&s=sports&sr=1-7657,3.0,2,₹287,"₹1,799"
Charged Energy-004 Interlock Knit Hexagon Emboss Round Neck Sports T-Shirt Teal Size Xs And Charged Play-005 Interlock Kni...,sports & fitness,Yoga,https://m.media-amazon.com/images/I/81Dm1nhKEOL._AC_UL320_.jpg,https://www.amazon.in/Energy-004-Interlock-Play-005-Geomatric-Dark-Grey/dp/B098P7X822/ref=sr_1_7658?qid=1679217967&s=sports&sr=1-7658,,,₹212.21,"₹1,048"
Charged Brisk-002 Melange Round Neck Sports T-Shirt Indigo Size 2Xl And Charged Pulse-006 Checker Knitt Round Neck Sports ...,sports & fitness,Yoga,https://m.media-amazon.com/images/I/812JPzvpkgL._AC_UL320_.jpg,https://www.amazon.in/Charged-Brisk-002-Melange-Polyester-Pulse-006/dp/B098P7VPQV/ref=sr_1_7659?qid=1679217967&s=sports&sr=1-7659,,,₹355.31,"₹1,098"
Charged Play-005 Interlock Knit Geomatric Emboss Polyester Round Neck Sports T-Shirt Dark-Grey Size Xl And Pulse-006 Check...,sports & fitness,Yoga,https://m.media-amazon.com/images/I/81jPiZJWmaL._AC_UL320_.jpg,https://www.amazon.in/Interlock-Geomatric-Polyester-Dark-Grey-Pulse-006/dp/B098P7BZ59/ref=sr_1_7660?qid=1679217967&s=sports&sr=1-7660,,,,₹998
Charged Energy-004 Interlock Knit Hexagon Emboss Round Neck Sports T-Shirt Grape-Green Size Xs And Charged Play-005 Interl...,sports & fitness,Yoga,https://m.media-amazon.com/images/I/81wkCv4nDIL._AC_UL320_.jpg,https://www.amazon.in/Energy-004-Interlock-Grape-Green-Geomatric-Dark-Grey/dp/B098P58VXM/ref=sr_1_7661?qid=1679217967&s=sports&sr=1-7661,,,,
